{
  "$schema": "image-preflight-fuzz-evidence.schema.json",
  "schemaVersion": 1,
  "status": "verified",
  "sourceCommit": "21c0d092a698c0a84cce735d28665ef675f9c34b",
  "corpusManifestSha256": "eb3037e4bcb665a0ca08e79688affa3ed273b4200a20f0ed522b552903c4eb9f",
  "testFilter": "FullyQualifiedName~IdentifyDeterministicMutationCorpus",
  "timeoutSeconds": 120,
  "maxWorkingSetGrowthBytes": 268435456,
  "nativeRuntimeRequired": false,
  "runner": {
    "os": "Microsoft Windows NT 10.0.26200.0",
    "architecture": "x64",
    "dotnet": "10.0.401",
    "configuration": "Release"
  },
  "frameworks": [
    {
      "targetFramework": "net8.0",
      "status": "clean",
      "failureClass": "clean",
      "exitCode": 0,
      "durationMilliseconds": 12029,
      "fixtureCount": 14,
      "expectedMinimumMutations": 1000,
      "baselineWorkingSetBytes": 5541888,
      "peakWorkingSetBytes": 146505728,
      "workingSetGrowthBytes": 140963840,
      "resourceLeakObserved": false,
      "managedUnhandledExceptionCount": 0,
      "managedTestFailureCount": 0,
      "oomCount": 0,
      "crashCount": 0,
      "hangCount": 0,
      "failureSummary": ""
    },
    {
      "targetFramework": "net10.0",
      "status": "clean",
      "failureClass": "clean",
      "exitCode": 0,
      "durationMilliseconds": 12212,
      "fixtureCount": 14,
      "expectedMinimumMutations": 1000,
      "baselineWorkingSetBytes": 3551232,
      "peakWorkingSetBytes": 146309120,
      "workingSetGrowthBytes": 142757888,
      "resourceLeakObserved": false,
      "managedUnhandledExceptionCount": 0,
      "managedTestFailureCount": 0,
      "oomCount": 0,
      "crashCount": 0,
      "hangCount": 0,
      "failureSummary": ""
    }
  ],
  "classifications": {
    "clean": 2,
    "managedUnhandledException": 0,
    "managedTestFailure": 0,
    "oom": 0,
    "crash": 0,
    "hang": 0,
    "resourceLeak": 0
  },
  "limitations": [
    "The corpus is deterministic managed preflight coverage; it is not coverage-guided native fuzzing.",
    "The isolated dotnet test process distinguishes clean, managed failure, OOM, crash, and timeout outcomes.",
    "WorkingSet64 is sampled process RSS evidence for this runner; process teardown cannot prove absence of a long-lived native leak.",
    "No native runtime is required because the tested Identify paths stop before native decoding."
  ]
}
